ResNet-50/50p_Model/resnet-50.log
{"input": ["cuda -model=unknown", "conv2d_nchw.cuda", [["TENSOR", [1, 1024, 14, 14], "float32"], ["TENSOR", [2048, 1024, 1, 1], "float32"], [2, 2], [0, 0, 0, 0], [1, 1], "float32"], {}], "config": {"index": 283607, "code_hash": null, "entity": [["tile_f", "sp", [-1, 2, 32, 1]], ["tile_y", "sp", [-1, 1, 1, 7]], ["tile_x", "sp", [-1, 1, 7, 1]], ["tile_rc", "sp", [-1, 16]], ["tile_ry", "sp", [-1, 1]], ["tile_rx", "sp", [-1, 1]], ["auto_unroll_max_step", "ot", 512], ["unroll_explicit", "ot", 1]]}, "result": [[0.00014533042624924745], 0, 38.22737240791321, 1590978975.4650228], "version": 0.2, "tvm_version": "0.7.dev1"}
{"input": ["cuda -model=unknown", "conv2d_nchw.cuda", [["TENSOR", [1, 512, 28, 28], "float32"], ["TENSOR", [1024, 512, 1, 1], "float32"], [2, 2], [0, 0, 0, 0], [1, 1], "float32"], {}], "config": {"index": 332086, "code_hash": null, "entity": [["tile_f", "sp", [-1, 4, 16, 1]], ["tile_y", "sp", [-1, 1, 1, 2]], ["tile_x", "sp", [-1, 1, 14, 1]], ["tile_rc", "sp", [-1, 16]], ["tile_ry", "sp", [-1, 1]], ["tile_rx", "sp", [-1, 1]], ["auto_unroll_max_step", "ot", 0], ["unroll_explicit", "ot", 0]]}, "result": [[8.416650797503468e-05], 0, 83.9179277420044, 1590982249.957579], "version": 0.2, "tvm_version": "0.7.dev1"}
{"input": ["cuda -model=unknown", "conv2d_nchw.cuda", [["TENSOR", [1, 256, 56, 56], "float32"], ["TENSOR", [512, 256, 1, 1], "float32"], [2, 2], [0, 0, 0, 0], [1, 1], "float32"], {}], "config": {"index": 17388837, "code_hash": null, "entity": [["tile_f", "sp", [-1, 8, 16, 1]], ["tile_y", "sp", [-1, 1, 1, 1]], ["tile_x", "sp", [-1, 2, 14, 1]], ["tile_rc", "sp", [-1, 16]], ["tile_ry", "sp", [-1, 1]], ["tile_rx", "sp", [-1, 1]], ["auto_unroll_max_step", "ot", 1500], ["unroll_explicit", "ot", 1]]}, "result": [[7.247846640671866e-05], 0, 42.80096769332886, 1590984588.6644692], "version": 0.2, "tvm_version": "0.7.dev1"}
{"input": ["cuda -model=unknown", "conv2d_nchw.cuda", [["TENSOR", [1, 3, 224, 224], "float32"], ["TENSOR", [64, 3, 7, 7], "float32"], [2, 2], [3, 3, 3, 3], [1, 1], "float32"], {}], "config": {"index": 72888500, "code_hash": null, "entity": [["tile_f", "sp", [-1, 4, 8, 1]], ["tile_y", "sp", [-1, 1, 1, 1]], ["tile_x", "sp", [-1, 7, 16, 1]], ["tile_rc", "sp", [-1, 1]], ["tile_ry", "sp", [-1, 1]], ["tile_rx", "sp", [-1, 7]], ["auto_unroll_max_step", "ot", 1500], ["unroll_explicit", "ot", 1]]}, "result": [[5.344000517202608e-05], 0, 50.61774826049805, 1590986422.0732527], "version": 0.2, "tvm_version": "0.7.dev1"}
{"input": ["cuda -model=unknown", "conv2d_nchw.cuda", [["TENSOR", [1, 64, 56, 56], "float32"], ["TENSOR", [64, 64, 1, 1], "float32"], [1, 1], [0, 0, 0, 0], [1, 1], "float32"], {}], "config": {"index": 9327380, "code_hash": null, "entity": [["tile_f", "sp", [-1, 4, 8, 1]], ["tile_y", "sp", [-1, 1, 1, 1]], ["tile_x", "sp", [-1, 2, 28, 1]], ["tile_rc", "sp", [-1, 8]], ["tile_ry", "sp", [-1, 1]], ["tile_rx", "sp", [-1, 1]], ["auto_unroll_max_step", "ot", 1500], ["unroll_explicit", "ot", 0]]}, "result": [[1.0713109084034408e-05], 0, 3.5794436931610107, 1590988487.1733885], "version": 0.2, "tvm_version": "0.7.dev1"}
{"input": ["cuda -model=unknown", "conv2d_nchw.cuda", [["TENSOR", [1, 256, 56, 56], "float32"], ["TENSOR", [64, 256, 1, 1], "float32"], [1, 1], [0, 0, 0, 0], [1, 1], "float32"], {}], "config": {"index": 26510424, "code_hash": null, "entity": [["tile_f", "sp", [-1, 4, 16, 1]], ["tile_y", "sp", [-1, 1, 1, 1]], ["tile_x", "sp", [-1, 2, 14, 1]], ["tile_rc", "sp", [-1, 16]], ["tile_ry", "sp", [-1, 1]], ["tile_rx", "sp", [-1, 1]], ["auto_unroll_max_step", "ot", 1500], ["unroll_explicit", "ot", 1]]}, "result": [[3.5647956528301884e-05], 0, 17.83971929550171, 1590990174.5159414], "version": 0.2, "tvm_version": "0.7.dev1"}
{"input": ["cuda -model=unknown", "conv2d_nchw_winograd.cuda", [["TENSOR", [1, 64, 56, 56], "float32"], ["TENSOR", [64, 64, 3, 3], "float32"], [1, 1], [1, 1, 1, 1], [1, 1], "float32"], {}], "config": {"index": 330529, "code_hash": null, "entity": [["tile_b", "sp", [-1, 1, 1, 1]], ["tile_y", "sp", [-1, 1, 8, 8]], ["tile_x", "sp", [-1, 2, 98, 1]], ["tile_rc", "sp", [-1, 16]], ["auto_unroll_max_step", "ot", 1500], ["unroll_explicit", "ot", 1]]}, "result": [[3.392395106990014e-05], 0, 17.79052495956421, 1590995215.1934488], "version": 0.2, "tvm_version": "0.7.dev1"}
{"input": ["cuda -model=unknown", "conv2d_nchw.cuda", [["TENSOR", [1, 64, 56, 56], "float32"], ["TENSOR", [64, 64, 3, 3], "float32"], [1, 1], [1, 1, 1, 1], [1, 1], "float32"], {}], "config": {"index": 87777082, "code_hash": null, "entity": [["tile_f", "sp", [-1, 1, 16, 1]], ["tile_y", "sp", [-1, 14, 1, 1]], ["tile_x", "sp", [-1, 1, 8, 1]], ["tile_rc", "sp", [-1, 4]], ["tile_ry", "sp", [-1, 3]], ["tile_rx", "sp", [-1, 3]], ["auto_unroll_max_step", "ot", 1500], ["unroll_explicit", "ot", 1]]}, "result": [[5.9151428493449785e-05], 0, 2.1002321243286133, 1590998588.6547778], "version": 0.2, "tvm_version": "0.7.dev1"}
{"input": ["cuda -model=unknown", "conv2d_nchw.cuda", [["TENSOR", [1, 64, 56, 56], "float32"], ["TENSOR", [256, 64, 1, 1], "float32"], [1, 1], [0, 0, 0, 0], [1, 1], "float32"], {}], "config": {"index": 18334992, "code_hash": null, "entity": [["tile_f", "sp", [-1, 8, 8, 1]], ["tile_y", "sp", [-1, 2, 1, 1]], ["tile_x", "sp", [-1, 1, 56, 1]], ["tile_rc", "sp", [-1, 8]], ["tile_ry", "sp", [-1, 1]], ["tile_rx", "sp", [-1, 1]], ["auto_unroll_max_step", "ot", 1500], ["unroll_explicit", "ot", 0]]}, "result": [[2.7416056484149856e-05], 0, 63.972264766693115, 1591001508.9669619], "version": 0.2, "tvm_version": "0.7.dev1"}
{"input": ["cuda -model=unknown", "conv2d_nchw.cuda", [["TENSOR", [1, 256, 56, 56], "float32"], ["TENSOR", [128, 256, 1, 1], "float32"], [2, 2], [0, 0, 0, 0], [1, 1], "float32"], {}], "config": {"index": 4296028, "code_hash": null, "entity": [["tile_f", "sp", [-1, 4, 16, 1]], ["tile_y", "sp", [-1, 1, 1, 1]], ["tile_x", "sp", [-1, 1, 14, 1]], ["tile_rc", "sp", [-1, 16]], ["tile_ry", "sp", [-1, 1]], ["tile_rx", "sp", [-1, 1]], ["auto_unroll_max_step", "ot", 1500], ["unroll_explicit", "ot", 0]]}, "result": [[2.7773226942883895e-05], 0, 14.359688758850098, 1591003962.9464064], "version": 0.2, "tvm_version": "0.7.dev1"}
{"input": ["cuda -model=unknown", "conv2d_nchw.cuda", [["TENSOR", [1, 512, 28, 28], "float32"], ["TENSOR", [128, 512, 1, 1], "float32"], [1, 1], [0, 0, 0, 0], [1, 1], "float32"], {}], "config": {"index": 8522183, "code_hash": null, "entity": [["tile_f", "sp", [-1, 4, 8, 1]], ["tile_y", "sp", [-1, 1, 1, 2]], ["tile_x", "sp", [-1, 1, 14, 1]], ["tile_rc", "sp", [-1, 16]], ["tile_ry", "sp", [-1, 1]], ["tile_rx", "sp", [-1, 1]], ["auto_unroll_max_step", "ot", 512], ["unroll_explicit", "ot", 1]]}, "result": [[4.3663395954810496e-05], 0, 3.1626884937286377, 1591006670.9055965], "version": 0.2, "tvm_version": "0.7.dev1"}
{"input": ["cuda -model=unknown", "conv2d_nchw_winograd.cuda", [["TENSOR", [1, 128, 28, 28], "float32"], ["TENSOR", [128, 128, 3, 3], "float32"], [1, 1], [1, 1, 1, 1], [1, 1], "float32"], {}], "config": {"index": 459817, "code_hash": null, "entity": [["tile_b", "sp", [-1, 1, 1, 1]], ["tile_y", "sp", [-1, 1, 8, 8]], ["tile_x", "sp", [-1, 2, 49, 1]], ["tile_rc", "sp", [-1, 64]], ["auto_unroll_max_step", "ot", 128], ["unroll_explicit", "ot", 1]]}, "result": [[4.1279633281707106e-05], 0, 9.513666152954102, 1591009053.3660297], "version": 0.2, "tvm_version": "0.7.dev1"}
{"input": ["cuda -model=unknown", "conv2d_nchw.cuda", [["TENSOR", [1, 128, 28, 28], "float32"], ["TENSOR", [128, 128, 3, 3], "float32"], [1, 1], [1, 1, 1, 1], [1, 1], "float32"], {}], "config": {"index": 35880746, "code_hash": null, "entity": [["tile_f", "sp", [-1, 1, 16, 1]], ["tile_y", "sp", [-1, 1, 2, 1]], ["tile_x", "sp", [-1, 1, 4, 7]], ["tile_rc", "sp", [-1, 4]], ["tile_ry", "sp", [-1, 3]], ["tile_rx", "sp", [-1, 3]], ["auto_unroll_max_step", "ot", 1500], ["unroll_explicit", "ot", 1]]}, "result": [[6.763673320213663e-05], 0, 38.35427784919739, 1591011385.1627054], "version": 0.2, "tvm_version": "0.7.dev1"}
{"input": ["cuda -model=unknown", "conv2d_nchw.cuda", [["TENSOR", [1, 128, 28, 28], "float32"], ["TENSOR", [512, 128, 1, 1], "float32"], [1, 1], [0, 0, 0, 0], [1, 1], "float32"], {}], "config": {"index": 7189856, "code_hash": null, "entity": [["tile_f", "sp", [-1, 4, 16, 1]], ["tile_y", "sp", [-1, 2, 1, 1]], ["tile_x", "sp", [-1, 1, 28, 1]], ["tile_rc", "sp", [-1, 16]], ["tile_ry", "sp", [-1, 1]], ["tile_rx", "sp", [-1, 1]], ["auto_unroll_max_step", "ot", 1500], ["unroll_explicit", "ot", 0]]}, "result": [[2.8404195440911818e-05], 0, 56.12072396278381, 1591014152.8983643], "version": 0.2, "tvm_version": "0.7.dev1"}
{"input": ["cuda -model=unknown", "conv2d_nchw.cuda", [["TENSOR", [1, 512, 28, 28], "float32"], ["TENSOR", [256, 512, 1, 1], "float32"], [2, 2], [0, 0, 0, 0], [1, 1], "float32"], {}], "config": {"index": 1034911, "code_hash": null, "entity": [["tile_f", "sp", [-1, 2, 16, 1]], ["tile_y", "sp", [-1, 1, 1, 1]], ["tile_x", "sp", [-1, 1, 14, 1]], ["tile_rc", "sp", [-1, 16]], ["tile_ry", "sp", [-1, 1]], ["tile_rx", "sp", [-1, 1]], ["auto_unroll_max_step", "ot", 1500], ["unroll_explicit", "ot", 0]]}, "result": [[3.5636322513089005e-05], 0, 2.4176130294799805, 1591017083.2163653], "version": 0.2, "tvm_version": "0.7.dev1"}
{"input": ["cuda -model=unknown", "conv2d_nchw.cuda", [["TENSOR", [1, 1024, 14, 14], "float32"], ["TENSOR", [256, 1024, 1, 1], "float32"], [1, 1], [0, 0, 0, 0], [1, 1], "float32"], {}], "config": {"index": 2521885, "code_hash": null, "entity": [["tile_f", "sp", [-1, 2, 8, 1]], ["tile_y", "sp", [-1, 1, 2, 1]], ["tile_x", "sp", [-1, 1, 7, 2]], ["tile_rc", "sp", [-1, 16]], ["tile_ry", "sp", [-1, 1]], ["tile_rx", "sp", [-1, 1]], ["auto_unroll_max_step", "ot", 1500], ["unroll_explicit", "ot", 1]]}, "result": [[5.821899709020369e-05], 0, 5.97457218170166, 1591019771.6446376], "version": 0.2, "tvm_version": "0.7.dev1"}
{"input": ["cuda -model=unknown", "conv2d_nchw_winograd.cuda", [["TENSOR", [1, 256, 14, 14], "float32"], ["TENSOR", [256, 256, 3, 3], "float32"], [1, 1], [1, 1, 1, 1], [1, 1], "float32"], {}], "config": {"index": 70032, "code_hash": null, "entity": [["tile_b", "sp", [-1, 1, 1, 1]], ["tile_y", "sp", [-1, 2, 16, 2]], ["tile_x", "sp", [-1, 7, 7, 1]], ["tile_rc", "sp", [-1, 64]], ["auto_unroll_max_step", "ot", 128], ["unroll_explicit", "ot", 1]]}, "result": [[4.2863383306466055e-05], 0, 76.69848871231079, 1591023030.0276687], "version": 0.2, "tvm_version": "0.7.dev1"}
{"input": ["cuda -model=unknown", "conv2d_nchw.cuda", [["TENSOR", [1, 256, 14, 14], "float32"], ["TENSOR", [256, 256, 3, 3], "float32"], [1, 1], [1, 1, 1, 1], [1, 1], "float32"], {}], "config": {"index": 7345170, "code_hash": null, "entity": [["tile_f", "sp", [-1, 1, 16, 1]], ["tile_y", "sp", [-1, 1, 2, 1]], ["tile_x", "sp", [-1, 1, 2, 7]], ["tile_rc", "sp", [-1, 4]], ["tile_ry", "sp", [-1, 3]], ["tile_rx", "sp", [-1, 3]], ["auto_unroll_max_step", "ot", 512], ["unroll_explicit", "ot", 1]]}, "result": [[9.198253396226415e-05], 0, 41.17772197723389, 1591024700.1400564], "version": 0.2, "tvm_version": "0.7.dev1"}
{"input": ["cuda -model=unknown", "conv2d_nchw.cuda", [["TENSOR", [1, 256, 14, 14], "float32"], ["TENSOR", [1024, 256, 1, 1], "float32"], [1, 1], [0, 0, 0, 0], [1, 1], "float32"], {}], "config": {"index": 3626806, "code_hash": null, "entity": [["tile_f", "sp", [-1, 4, 16, 1]], ["tile_y", "sp", [-1, 1, 1, 2]], ["tile_x", "sp", [-1, 1, 14, 1]], ["tile_rc", "sp", [-1, 16]], ["tile_ry", "sp", [-1, 1]], ["tile_rx", "sp", [-1, 1]], ["auto_unroll_max_step", "ot", 1500], ["unroll_explicit", "ot", 1]]}, "result": [[3.667384815551814e-05], 0, 19.34190034866333, 1591026310.4646997], "version": 0.2, "tvm_version": "0.7.dev1"}
{"input": ["cuda -model=unknown", "conv2d_nchw.cuda", [["TENSOR", [1, 1024, 14, 14], "float32"], ["TENSOR", [512, 1024, 1, 1], "float32"], [2, 2], [0, 0, 0, 0], [1, 1], "float32"], {}], "config": {"index": 93309, "code_hash": null, "entity": [["tile_f", "sp", [-1, 4, 8, 1]], ["tile_y", "sp", [-1, 1, 1, 1]], ["tile_x", "sp", [-1, 1, 7, 1]], ["tile_rc", "sp", [-1, 16]], ["tile_ry", "sp", [-1, 1]], ["tile_rx", "sp", [-1, 1]], ["auto_unroll_max_step", "ot", 1500], ["unroll_explicit", "ot", 0]]}, "result": [[7.175349835771871e-05], 0, 62.74379873275757, 1591028238.9495997], "version": 0.2, "tvm_version": "0.7.dev1"}
{"input": ["cuda -model=unknown", "conv2d_nchw.cuda", [["TENSOR", [1, 2048, 7, 7], "float32"], ["TENSOR", [512, 2048, 1, 1], "float32"], [1, 1], [0, 0, 0, 0], [1, 1], "float32"], {}], "config": {"index": 184829, "code_hash": null, "entity": [["tile_f", "sp", [-1, 4, 8, 1]], ["tile_y", "sp", [-1, 1, 1, 1]], ["tile_x", "sp", [-1, 1, 7, 1]], ["tile_rc", "sp", [-1, 16]], ["tile_ry", "sp", [-1, 1]], ["tile_rx", "sp", [-1, 1]], ["auto_unroll_max_step", "ot", 512], ["unroll_explicit", "ot", 1]]}, "result": [[0.00012058090587623506], 0, 21.41601848602295, 1591030428.6917102], "version": 0.2, "tvm_version": "0.7.dev1"}
{"input": ["cuda -model=unknown", "conv2d_nchw_winograd.cuda", [["TENSOR", [1, 512, 7, 7], "float32"], ["TENSOR", [512, 512, 3, 3], "float32"], [1, 1], [1, 1, 1, 1], [1, 1], "float32"], {}], "config": {"index": 351906, "code_hash": null, "entity": [["tile_b", "sp", [-1, 1, 1, 1]], ["tile_y", "sp", [-1, 1, 16, 4]], ["tile_x", "sp", [-1, 1, 8, 2]], ["tile_rc", "sp", [-1, 32]], ["auto_unroll_max_step", "ot", 128], ["unroll_explicit", "ot", 1]]}, "result": [[5.0923941796710246e-05], 0, 76.89069700241089, 1591032605.366876], "version": 0.2, "tvm_version": "0.7.dev1"}
{"input": ["cuda -model=unknown", "conv2d_nchw.cuda", [["TENSOR", [1, 512, 7, 7], "float32"], ["TENSOR", [512, 512, 3, 3], "float32"], [1, 1], [1, 1, 1, 1], [1, 1], "float32"], {}], "config": {"index": 784539, "code_hash": null, "entity": [["tile_f", "sp", [-1, 1, 4, 1]], ["tile_y", "sp", [-1, 1, 7, 1]], ["tile_x", "sp", [-1, 1, 1, 7]], ["tile_rc", "sp", [-1, 4]], ["tile_ry", "sp", [-1, 1]], ["tile_rx", "sp", [-1, 3]], ["auto_unroll_max_step", "ot", 1500], ["unroll_explicit", "ot", 1]]}, "result": [[0.00017981380729166667], 0, 28.116894960403442, 1591037461.7389133], "version": 0.2, "tvm_version": "0.7.dev1"}
{"input": ["cuda -model=unknown", "conv2d_nchw.cuda", [["TENSOR", [1, 512, 7, 7], "float32"], ["TENSOR", [2048, 512, 1, 1], "float32"], [1, 1], [0, 0, 0, 0], [1, 1], "float32"], {}], "config": {"index": 323647, "code_hash": null, "entity": [["tile_f", "sp", [-1, 2, 32, 1]], ["tile_y", "sp", [-1, 7, 1, 1]], ["tile_x", "sp", [-1, 1, 7, 1]], ["tile_rc", "sp", [-1, 32]], ["tile_ry", "sp", [-1, 1]], ["tile_rx", "sp", [-1, 1]], ["auto_unroll_max_step", "ot", 1500], ["unroll_explicit", "ot", 1]]}, "result": [[5.2823417422065e-05], 0, 13.026213884353638, 1591038195.602492], "version": 0.2, "tvm_version": "0.7.dev1"}
