Mobilenet/25p_Model/mobilenet.log
{"input": ["cuda -model=unknown", "conv2d_nchw.cuda", [["TENSOR", [1, 3, 224, 224], "float32"], ["TENSOR", [32, 3, 3, 3], "float32"], [2, 2], [1, 1, 1, 1], [1, 1], "float32"], {}], "config": {"index": 41999584, "code_hash": null, "entity": [["tile_f", "sp", [-1, 4, 4, 2]], ["tile_y", "sp", [-1, 4, 2, 1]], ["tile_x", "sp", [-1, 1, 16, 1]], ["tile_rc", "sp", [-1, 1]], ["tile_ry", "sp", [-1, 3]], ["tile_rx", "sp", [-1, 3]], ["auto_unroll_max_step", "ot", 512], ["unroll_explicit", "ot", 1]]}, "result": [[1.4817466097374459e-05], 0, 11.464706659317017, 1591778978.9891098], "version": 0.2, "tvm_version": "0.7.dev1"}
{"input": ["cuda -model=unknown", "depthwise_conv2d_nchw.cuda", [["TENSOR", [1, 32, 112, 112], "float32"], ["TENSOR", [32, 1, 3, 3], "float32"], [1, 1], [1, 1, 1, 1], [1, 1], "float32"], {}], "config": {"index": 5830328, "code_hash": null, "entity": [["tile_f", "sp", [-1, 1, 1, 1]], ["tile_y", "sp", [-1, 1, 1, 7]], ["tile_x", "sp", [-1, 2, 56, 1]], ["auto_unroll_max_step", "ot", 1500], ["unroll_explicit", "ot", 1]]}, "result": [[1.0690034167175107e-05], 0, 11.599088430404663, 1591782657.07339], "version": 0.2, "tvm_version": "0.7.dev1"}
{"input": ["cuda -model=unknown", "conv2d_nchw.cuda", [["TENSOR", [1, 32, 112, 112], "float32"], ["TENSOR", [64, 32, 1, 1], "float32"], [1, 1], [0, 0, 0, 0], [1, 1], "float32"], {}], "config": {"index": 54674781, "code_hash": null, "entity": [["tile_f", "sp", [-1, 8, 8, 1]], ["tile_y", "sp", [-1, 2, 8, 1]], ["tile_x", "sp", [-1, 1, 8, 1]], ["tile_rc", "sp", [-1, 8]], ["tile_ry", "sp", [-1, 1]], ["tile_rx", "sp", [-1, 1]], ["auto_unroll_max_step", "ot", 1500], ["unroll_explicit", "ot", 1]]}, "result": [[2.8449741172274404e-05], 0, 27.116782665252686, 1591783802.629642], "version": 0.2, "tvm_version": "0.7.dev1"}
{"input": ["cuda -model=unknown", "depthwise_conv2d_nchw.cuda", [["TENSOR", [1, 64, 112, 112], "float32"], ["TENSOR", [64, 1, 3, 3], "float32"], [2, 2], [1, 1, 1, 1], [1, 1], "float32"], {}], "config": {"index": 2885568, "code_hash": null, "entity": [["tile_f", "sp", [-1, 1, 1, 1]], ["tile_y", "sp", [-1, 4, 1, 2]], ["tile_x", "sp", [-1, 1, 56, 1]], ["auto_unroll_max_step", "ot", 1500], ["unroll_explicit", "ot", 1]]}, "result": [[1.1474184729064038e-05], 0, 14.25972843170166, 1591785475.1702595], "version": 0.2, "tvm_version": "0.7.dev1"}
{"input": ["cuda -model=unknown", "conv2d_nchw.cuda", [["TENSOR", [1, 64, 56, 56], "float32"], ["TENSOR", [128, 64, 1, 1], "float32"], [1, 1], [0, 0, 0, 0], [1, 1], "float32"], {}], "config": {"index": 13338024, "code_hash": null, "entity": [["tile_f", "sp", [-1, 8, 8, 1]], ["tile_y", "sp", [-1, 1, 1, 2]], ["tile_x", "sp", [-1, 1, 56, 1]], ["tile_rc", "sp", [-1, 8]], ["tile_ry", "sp", [-1, 1]], ["tile_rx", "sp", [-1, 1]], ["auto_unroll_max_step", "ot", 1500], ["unroll_explicit", "ot", 0]]}, "result": [[2.7828905192425168e-05], 0, 15.168287515640259, 1591787979.3049588], "version": 0.2, "tvm_version": "0.7.dev1"}
{"input": ["cuda -model=unknown", "depthwise_conv2d_nchw.cuda", [["TENSOR", [1, 128, 56, 56], "float32"], ["TENSOR", [128, 1, 3, 3], "float32"], [1, 1], [1, 1, 1, 1], [1, 1], "float32"], {}], "config": {"index": 3346680, "code_hash": null, "entity": [["tile_f", "sp", [-1, 1, 1, 1]], ["tile_y", "sp", [-1, 2, 1, 4]], ["tile_x", "sp", [-1, 2, 28, 1]], ["auto_unroll_max_step", "ot", 256], ["unroll_explicit", "ot", 1]]}, "result": [[1.1726568649045521e-05], 0, 46.63738822937012, 1591790291.6606953], "version": 0.2, "tvm_version": "0.7.dev1"}
{"input": ["cuda -model=unknown", "conv2d_nchw.cuda", [["TENSOR", [1, 128, 56, 56], "float32"], ["TENSOR", [128, 128, 1, 1], "float32"], [1, 1], [0, 0, 0, 0], [1, 1], "float32"], {}], "config": {"index": 14039696, "code_hash": null, "entity": [["tile_f", "sp", [-1, 4, 8, 2]], ["tile_y", "sp", [-1, 2, 2, 2]], ["tile_x", "sp", [-1, 1, 8, 1]], ["tile_rc", "sp", [-1, 4]], ["tile_ry", "sp", [-1, 1]], ["tile_rx", "sp", [-1, 1]], ["auto_unroll_max_step", "ot", 1500], ["unroll_explicit", "ot", 0]]}, "result": [[4.983306032868733e-05], 0, 24.014968633651733, 1591794887.5179648], "version": 0.2, "tvm_version": "0.7.dev1"}
{"input": ["cuda -model=unknown", "depthwise_conv2d_nchw.cuda", [["TENSOR", [1, 128, 56, 56], "float32"], ["TENSOR", [128, 1, 3, 3], "float32"], [2, 2], [1, 1, 1, 1], [1, 1], "float32"], {}], "config": {"index": 1044840, "code_hash": null, "entity": [["tile_f", "sp", [-1, 1, 1, 1]], ["tile_y", "sp", [-1, 1, 1, 4]], ["tile_x", "sp", [-1, 1, 28, 1]], ["auto_unroll_max_step", "ot", 1500], ["unroll_explicit", "ot", 1]]}, "result": [[7.444211305695723e-06], 0, 26.125811100006104, 1591796345.565922], "version": 0.2, "tvm_version": "0.7.dev1"}
{"input": ["cuda -model=unknown", "conv2d_nchw.cuda", [["TENSOR", [1, 128, 28, 28], "float32"], ["TENSOR", [256, 128, 1, 1], "float32"], [1, 1], [0, 0, 0, 0], [1, 1], "float32"], {}], "config": {"index": 11467238, "code_hash": null, "entity": [["tile_f", "sp", [-1, 4, 8, 2]], ["tile_y", "sp", [-1, 1, 1, 2]], ["tile_x", "sp", [-1, 1, 28, 1]], ["tile_rc", "sp", [-1, 8]], ["tile_ry", "sp", [-1, 1]], ["tile_rx", "sp", [-1, 1]], ["auto_unroll_max_step", "ot", 1500], ["unroll_explicit", "ot", 1]]}, "result": [[3.156520479851538e-05], 0, 7.4950079917907715, 1591798805.4300985], "version": 0.2, "tvm_version": "0.7.dev1"}
{"input": ["cuda -model=unknown", "depthwise_conv2d_nchw.cuda", [["TENSOR", [1, 256, 28, 28], "float32"], ["TENSOR", [256, 1, 3, 3], "float32"], [1, 1], [1, 1, 1, 1], [1, 1], "float32"], {}], "config": {"index": 1172325, "code_hash": null, "entity": [["tile_f", "sp", [-1, 1, 1, 1]], ["tile_y", "sp", [-1, 2, 7, 2]], ["tile_x", "sp", [-1, 1, 28, 1]], ["auto_unroll_max_step", "ot", 256], ["unroll_explicit", "ot", 1]]}, "result": [[8.564894018572128e-06], 0, 7.9728827476501465, 1591800835.4175272], "version": 0.2, "tvm_version": "0.7.dev1"}
{"input": ["cuda -model=unknown", "conv2d_nchw.cuda", [["TENSOR", [1, 256, 28, 28], "float32"], ["TENSOR", [256, 256, 1, 1], "float32"], [1, 1], [0, 0, 0, 0], [1, 1], "float32"], {}], "config": {"index": 12787197, "code_hash": null, "entity": [["tile_f", "sp", [-1, 8, 8, 1]], ["tile_y", "sp", [-1, 1, 1, 2]], ["tile_x", "sp", [-1, 1, 28, 1]], ["tile_rc", "sp", [-1, 8]], ["tile_ry", "sp", [-1, 1]], ["tile_rx", "sp", [-1, 1]], ["auto_unroll_max_step", "ot", 1500], ["unroll_explicit", "ot", 1]]}, "result": [[5.7389024667931694e-05], 0, 16.50710892677307, 1591803693.002021], "version": 0.2, "tvm_version": "0.7.dev1"}
{"input": ["cuda -model=unknown", "depthwise_conv2d_nchw.cuda", [["TENSOR", [1, 256, 28, 28], "float32"], ["TENSOR", [256, 1, 3, 3], "float32"], [2, 2], [1, 1, 1, 1], [1, 1], "float32"], {}], "config": {"index": 232815, "code_hash": null, "entity": [["tile_f", "sp", [-1, 1, 1, 1]], ["tile_y", "sp", [-1, 14, 1, 1]], ["tile_x", "sp", [-1, 1, 14, 1]], ["auto_unroll_max_step", "ot", 1500], ["unroll_explicit", "ot", 1]]}, "result": [[6.926726572255216e-06], 0, 3.645967483520508, 1591805768.0354028], "version": 0.2, "tvm_version": "0.7.dev1"}
{"input": ["cuda -model=unknown", "conv2d_nchw.cuda", [["TENSOR", [1, 256, 14, 14], "float32"], ["TENSOR", [512, 256, 1, 1], "float32"], [1, 1], [0, 0, 0, 0], [1, 1], "float32"], {}], "config": {"index": 763046, "code_hash": null, "entity": [["tile_f", "sp", [-1, 2, 16, 2]], ["tile_y", "sp", [-1, 1, 1, 7]], ["tile_x", "sp", [-1, 1, 14, 1]], ["tile_rc", "sp", [-1, 16]], ["tile_ry", "sp", [-1, 1]], ["tile_rx", "sp", [-1, 1]], ["auto_unroll_max_step", "ot", 512], ["unroll_explicit", "ot", 0]]}, "result": [[3.8714238625041516e-05], 0, 44.28088927268982, 1591807756.6384091], "version": 0.2, "tvm_version": "0.7.dev1"}
{"input": ["cuda -model=unknown", "depthwise_conv2d_nchw.cuda", [["TENSOR", [1, 512, 14, 14], "float32"], ["TENSOR", [512, 1, 3, 3], "float32"], [1, 1], [1, 1, 1, 1], [1, 1], "float32"], {}], "config": {"index": 141900, "code_hash": null, "entity": [["tile_f", "sp", [-1, 1, 1, 1]], ["tile_y", "sp", [-1, 7, 2, 1]], ["tile_x", "sp", [-1, 1, 14, 1]], ["auto_unroll_max_step", "ot", 1500], ["unroll_explicit", "ot", 0]]}, "result": [[6.744042294322132e-06], 0, 40.07327318191528, 1591809891.4584498], "version": 0.2, "tvm_version": "0.7.dev1"}
{"input": ["cuda -model=unknown", "conv2d_nchw.cuda", [["TENSOR", [1, 512, 14, 14], "float32"], ["TENSOR", [512, 512, 1, 1], "float32"], [1, 1], [0, 0, 0, 0], [1, 1], "float32"], {}], "config": {"index": 817115, "code_hash": null, "entity": [["tile_f", "sp", [-1, 2, 16, 1]], ["tile_y", "sp", [-1, 7, 1, 1]], ["tile_x", "sp", [-1, 1, 14, 1]], ["tile_rc", "sp", [-1, 16]], ["tile_ry", "sp", [-1, 1]], ["tile_rx", "sp", [-1, 1]], ["auto_unroll_max_step", "ot", 512], ["unroll_explicit", "ot", 0]]}, "result": [[7.677423266219239e-05], 0, 32.58406591415405, 1591814517.4352741], "version": 0.2, "tvm_version": "0.7.dev1"}
{"input": ["cuda -model=unknown", "depthwise_conv2d_nchw.cuda", [["TENSOR", [1, 512, 14, 14], "float32"], ["TENSOR", [512, 1, 3, 3], "float32"], [2, 2], [1, 1, 1, 1], [1, 1], "float32"], {}], "config": {"index": 19800, "code_hash": null, "entity": [["tile_f", "sp", [-1, 1, 1, 1]], ["tile_y", "sp", [-1, 1, 7, 1]], ["tile_x", "sp", [-1, 1, 7, 1]], ["auto_unroll_max_step", "ot", 1500], ["unroll_explicit", "ot", 1]]}, "result": [[5.396445985927749e-06], 0, 8.268399715423584, 1591814739.2479298], "version": 0.2, "tvm_version": "0.7.dev1"}
{"input": ["cuda -model=unknown", "conv2d_nchw.cuda", [["TENSOR", [1, 512, 7, 7], "float32"], ["TENSOR", [1024, 512, 1, 1], "float32"], [1, 1], [0, 0, 0, 0], [1, 1], "float32"], {}], "config": {"index": 254872, "code_hash": null, "entity": [["tile_f", "sp", [-1, 2, 32, 1]], ["tile_y", "sp", [-1, 1, 1, 7]], ["tile_x", "sp", [-1, 1, 7, 1]], ["tile_rc", "sp", [-1, 32]], ["tile_ry", "sp", [-1, 1]], ["tile_rx", "sp", [-1, 1]], ["auto_unroll_max_step", "ot", 1500], ["unroll_explicit", "ot", 1]]}, "result": [[5.203650737207286e-05], 0, 22.664812803268433, 1591815849.7298937], "version": 0.2, "tvm_version": "0.7.dev1"}
{"input": ["cuda -model=unknown", "depthwise_conv2d_nchw.cuda", [["TENSOR", [1, 1024, 7, 7], "float32"], ["TENSOR", [1024, 1, 3, 3], "float32"], [1, 1], [1, 1, 1, 1], [1, 1], "float32"], {}], "config": {"index": 21230, "code_hash": null, "entity": [["tile_f", "sp", [-1, 1, 1, 2]], ["tile_y", "sp", [-1, 1, 7, 1]], ["tile_x", "sp", [-1, 1, 7, 1]], ["auto_unroll_max_step", "ot", 256], ["unroll_explicit", "ot", 1]]}, "result": [[5.77814588176478e-06], 0, 3.405006170272827, 1591816868.4065044], "version": 0.2, "tvm_version": "0.7.dev1"}
{"input": ["cuda -model=unknown", "conv2d_nchw.cuda", [["TENSOR", [1, 1024, 7, 7], "float32"], ["TENSOR", [1024, 1024, 1, 1], "float32"], [1, 1], [0, 0, 0, 0], [1, 1], "float32"], {}], "config": {"index": 277180, "code_hash": null, "entity": [["tile_f", "sp", [-1, 2, 32, 1]], ["tile_y", "sp", [-1, 7, 1, 1]], ["tile_x", "sp", [-1, 1, 7, 1]], ["tile_rc", "sp", [-1, 32]], ["tile_ry", "sp", [-1, 1]], ["tile_rx", "sp", [-1, 1]], ["auto_unroll_max_step", "ot", 1500], ["unroll_explicit", "ot", 1]]}, "result": [[0.0001000952276530163], 0, 32.139273166656494, 1591819502.2727377], "version": 0.2, "tvm_version": "0.7.dev1"}
